18:02:59.394961 IP lamp-s-1vcpu-1gb-tor1-01.ssh > 222.186.15.166.37431: Flags [P.], seq 42:1122, ack 872, win 504, options [nop,nop,TS val 4259227746 ecr 4420357], length 1080
18:03:03.233777 IP cpc146684-stkn18-2-0-cust226.11-2.cable.virginm.net.10899 > lamp-s-1vcpu-1gb-tor1-01.http: Flags [S], seq 1543579369, win 5840, length 0
18:03:03.233876 IP lamp-s-1vcpu-1gb-tor1-01.http > cpc146684-stkn18-2-0-cust226.11-2.cable.virginm.net.10899: Flags [S.], seq 1428913571, ack 1543579370, win 64240, options [mss 1460], length 0
18:03:03.744212 IP 61.60.247.230.26651 > lamp-s-1vcpu-1gb-tor1-01.81: Flags [S], seq 2019713954, win 14600, length 0
18:03:04.259333 IP lamp-s-1vcpu-1gb-tor1-01.http > cpc146684-stkn18-2-0-cust226.11-2.cable.virginm.net.10899: Flags [S.], seq 1428913571, ack 1543579370, win 64240, options [mss 1460], length 0
18:03:06.274974 IP lamp-s-1vcpu-1gb-tor1-01.http > cpc146684-stkn18-2-0-cust226.11-2.cable.virginm.net.10899: Flags [S.], seq 1428913571, ack 1543579370, win 64240, options [mss 1460], length 0
18:03:08.082895 IP 185.175.93.101.53498 > lamp-s-1vcpu-1gb-tor1-01.5907: Flags [S], seq 72243467, win 1024, length 0
tcpdump: pcap_loop: truncated dump file; tried to read 1146 captured bytes, only got 80
root@lamp-s-1vcpu-1gb-tor1-01:~#
